{"$id":"https://closy.local/schemas/v1/closy-project-authored-synthetic-mechanical-calibration-report.schema.json","$schema":"https://json-schema.org/draft/2020-12/schema","additionalProperties":false,"oneOf":[{"additionalProperties":false,"properties":{"aggregate":{"additionalProperties":true,"type":"object"},"calibrationId":{"type":"string"},"calibrationVersion":{"const":"closy.synthetic_mechanical_calibration.d0.v2"},"corpus":{"additionalProperties":true,"type":"object"},"integrity":{"additionalProperties":false,"properties":{"reportHash":{"pattern":"^[0-9a-f]{64}$","type":"string"}},"required":["reportHash"],"type":"object"},"presets":{"items":{"type":"object"},"maxItems":4,"minItems":4,"type":"array"},"readiness":{"additionalProperties":{"type":"boolean"},"type":"object"},"schemaVersion":{"const":1},"solverVersion":{"const":"closy.bounded_coupon_inverse_grid.v1"},"sourceRegistryHash":{"pattern":"^[0-9a-f]{64}$","type":"string"},"truth":{"additionalProperties":true,"type":"object"},"unsupportedEvidence":{"items":{"type":"string"},"type":"array"}},"required":["schemaVersion","calibrationVersion","solverVersion","sourceRegistryHash","corpus","presets","aggregate","readiness","truth","unsupportedEvidence","integrity"],"type":"object"},{"additionalProperties":false,"properties":{"calibrationReportDigest":{"pattern":"^[0-9a-f]{64}$","type":"string"},"calibrationVersion":{"const":"closy.synthetic_mechanical_calibration.d0.v2"},"evidenceTier":{"const":"analytic_same_forward_model_inverse_harness"},"measuredRealFabric":{"const":false},"provenancePreserved":{"const":true},"referenceVersion":{"const":"closy.synthetic_material_reference.v1"},"registryDigest":{"pattern":"^[0-9a-f]{64}$","type":"string"},"registryVersion":{"const":"closy.fabric_preset_registry.d0.v1"},"schemaVersion":{"const":1},"selectedDescriptor":{"type":"object"},"selectedDescriptorDigest":{"pattern":"^[0-9a-f]{64}$","type":"string"},"selectedPresetId":{"type":"string"},"selectedSolverMapping":{"items":{"type":"object"},"maxItems":10,"minItems":10,"type":"array"},"selectedSolverMappingDigest":{"pattern":"^[0-9a-f]{64}$","type":"string"}},"required":["schemaVersion","referenceVersion","registryVersion","registryDigest","calibrationVersion","calibrationReportDigest","selectedPresetId","selectedDescriptor","selectedDescriptorDigest","selectedSolverMapping","selectedSolverMappingDigest","evidenceTier","measuredRealFabric","provenancePreserved"],"type":"object"}],"properties":{"aggregate":{"additionalProperties":true,"type":"object"},"calibrationId":{"type":"string"},"calibrationReportDigest":{"pattern":"^[0-9a-f]{64}$","type":"string"},"calibrationVersion":{"const":"closy.synthetic_mechanical_calibration.d0.v2"},"corpus":{"additionalProperties":true,"type":"object"},"evidenceTier":{"const":"analytic_same_forward_model_inverse_harness"},"integrity":{"additionalProperties":false,"properties":{"reportHash":{"pattern":"^[0-9a-f]{64}$","type":"string"}},"required":["reportHash"],"type":"object"},"measuredRealFabric":{"const":false},"presets":{"items":{"type":"object"},"maxItems":4,"minItems":4,"type":"array"},"provenancePreserved":{"const":true},"readiness":{"additionalProperties":{"type":"boolean"},"type":"object"},"referenceVersion":{"const":"closy.synthetic_material_reference.v1"},"registryDigest":{"pattern":"^[0-9a-f]{64}$","type":"string"},"registryVersion":{"const":"closy.fabric_preset_registry.d0.v1"},"schemaVersion":{"const":1},"selectedDescriptor":{"type":"object"},"selectedDescriptorDigest":{"pattern":"^[0-9a-f]{64}$","type":"string"},"selectedPresetId":{"type":"string"},"selectedSolverMapping":{"items":{"type":"object"},"maxItems":10,"minItems":10,"type":"array"},"selectedSolverMappingDigest":{"pattern":"^[0-9a-f]{64}$","type":"string"},"solverVersion":{"const":"closy.bounded_coupon_inverse_grid.v1"},"sourceRegistryHash":{"pattern":"^[0-9a-f]{64}$","type":"string"},"truth":{"additionalProperties":true,"type":"object"},"unsupportedEvidence":{"items":{"type":"string"},"type":"array"}},"required":["schemaVersion"],"title":"Closy project-authored synthetic mechanical calibration report","type":"object"}
