{"aggregate":{"calibratedToBaselineErrorRatio":3.3376516e-05,"finiteParameterRecordCount":40,"identifiableParameterRecordCount":40,"meanHoldoutNormalizedRmse":0.00202917925,"meanNormalizedParameterError":0.000143890198,"midpointBaselineMeanHoldoutNormalizedRmse":60.796617000637,"p95HoldoutNormalizedRmse":0.007851140399,"parameterRecordCount":40,"presetCount":4,"worstHoldoutNormalizedRmse":0.018635609549,"worstNormalizedParameterError":0.001139322917},"calibrationId":"material_calibration.project_authored_synthetic_coupons_v2","calibrationVersion":"closy.synthetic_mechanical_calibration.d0.v2","corpus":{"calibratedDescriptorFields":["thickness","arealDensity","warpStretchStiffness","weftStretchStiffness","shearStiffness","bendStiffness","dampingRatio","frictionCoefficient","collisionClearance","restitutionCoefficient"],"calibrationObservationCount":120,"calibrationStimuli":[0.72,1.08,1.44],"corpusVersion":"closy.synthetic_coupon_corpus.project_authored.v1","holdoutObservationCount":80,"observationCount":200,"observationSetHash":"dbf8becaefd0a3c19982de6aa8275aafda51551f74b8d49d6cfed33230297cc0","parameterCountPerPreset":10,"presetCount":4,"sourceKind":"deterministic_project_authored_synthetic_mechanical_tests","uncalibratedDescriptorFields":["warpOrientation"],"unseenHoldoutStimuli":[0.9,1.26]},"integrity":{"reportHash":"01391e3d42787960ab5f84f6d812cec5f9ae92a8c3e9d11b8b2ede50208c464c"},"presets":[{"allFinite":true,"allImproveMidpointBaseline":true,"descriptorHash":"9b001bb19afe3892bf615df1e548f94c1a7137447fd4d269049ade4b3a02e7ff","parameterCount":10,"parameters":[{"authoredSyntheticTruth":0.0008,"baselineHoldoutNormalizedRmse":0.579562040235,"calibrationObjective":2.34538e-07,"calibrationObservationHashes":["281c20bb2aa3dcba77a724eb588732136a4dba79e778b07abdb2d02de3a1c2c7","2f57adae245bd420eddf0e85bfd085788c3f16c932ada9c382b2619b45b79976","3810a48d195b59e5d8912e2cc7e2edb46e69b57b6e7cc2b788aa5a8ba5aa3465"],"candidateCount":2049,"estimatedValue":0.000800510447,"finite":true,"fixtureKind":"bounded_compression_coupon","gridResolutionInterval":[0.000799069857,0.000801953635],"holdoutNormalizedRmse":0.000606938361,"holdoutObservationHashes":["b839aac15b425b7d84683c238ba64ea6a561b38f0d096ee060972de0a1942be4","867b9ab330bf546cb10147d4187b3002319402db1e4f468b1c269329e68031d4"],"identifiableWithinGridResolution":true,"improvesMidpointBaseline":true,"intervalKind":"deterministic_grid_resolution_not_statistical_confidence","midpointBaselineValue":0.001264911064,"normalizedParameterError":6.5441947e-05,"observations":[{"fixtureKind":"bounded_compression_coupon","measuredResponse":0.000662455734,"observationHash":"281c20bb2aa3dcba77a724eb588732136a4dba79e778b07abdb2d02de3a1c2c7","observationId":"coupon.material.lightweight_knit_d0_v1.thickness.calibration.00","parameter":"thickness","realFabricMeasurement":false,"responseUnit":"m_compressed_thickness","sourceKind":"project_authored_synthetic_numerical_fixture","split":"calibration","stimulus":0.72,"stimulusUnit":"normalized_fixture_control"},{"fixtureKind":"bounded_compression_coupon","measuredResponse":0.000592956152,"observationHash":"2f57adae245bd420eddf0e85bfd085788c3f16c932ada9c382b2619b45b79976","observationId":"coupon.material.lightweight_knit_d0_v1.thickness.calibration.01","parameter":"thickness","realFabricMeasurement":false,"responseUnit":"m_compressed_thickness","sourceKind":"project_authored_synthetic_numerical_fixture","split":"calibration","stimulus":1.08,"stimulusUnit":"normalized_fixture_control"},{"fixtureKind":"bounded_compression_coupon","measuredResponse":0.000524232881,"observationHash":"3810a48d195b59e5d8912e2cc7e2edb46e69b57b6e7cc2b788aa5a8ba5aa3465","observationId":"coupon.material.lightweight_knit_d0_v1.thickness.calibration.02","parameter":"thickness","realFabricMeasurement":false,"responseUnit":"m_compressed_thickness","sourceKind":"project_authored_synthetic_numerical_fixture","split":"calibration","stimulus":1.44,"stimulusUnit":"normalized_fixture_control"},{"fixtureKind":"bounded_compression_coupon","measuredResponse":0.000627519629,"observationHash":"b839aac15b425b7d84683c238ba64ea6a561b38f0d096ee060972de0a1942be4","observationId":"coupon.material.lightweight_knit_d0_v1.thickness.holdout.00","parameter":"thickness","realFabricMeasurement":false,"responseUnit":"m_compressed_thickness","sourceKind":"project_authored_synthetic_numerical_fixture","split":"holdout","stimulus":0.9,"stimulusUnit":"normalized_fixture_control"},{"fixtureKind":"bounded_compression_coupon","measuredResponse":0.000558910427,"observationHash":"867b9ab330bf546cb10147d4187b3002319402db1e4f468b1c269329e68031d4","observationId":"coupon.material.lightweight_knit_d0_v1.thickness.holdout.01","parameter":"thickness","realFabricMeasurement":false,"responseUnit":"m_compressed_thickness","sourceKind":"project_authored_synthetic_numerical_fixture","split":"holdout","stimulus":1.26,"stimulusUnit":"normalized_fixture_control"}],"parameter":"thickness","recordHash":"c5dcc235df8e2db869d952321d943283b803dacf56842bfad58deb9e5e75ff17","searchBounds":[0.0002,0.008],"searchScale":"log","unit":"m"},{"authoredSyntheticTruth":0.115,"baselineHoldoutNormalizedRmse":0.347358226085,"calibrationObjective":4.37082e-07,"calibrationObservationHashes":["8b06bd033d68fd29dd9977a09c56355d6e93bfc87b34769eeade7c04dbffddf8","340c618c290d18dcc0c0d9800ab8951269bd988a10fb3fae17acfcdf3ec5fb27","bcd2340ab901a2d551791084d31c086ed7a5b930a286e801a34693c3047303d1"],"candidateCount":2049,"estimatedValue":0.114973749569,"finite":true,"fixtureKind":"tensioned_gravity_sag_coupon","gridResolutionInterval":[0.114789567926,0.115158226735],"holdoutNormalizedRmse":0.000210271447,"holdoutObservationHashes":["cdfe9ee942f3331791a641f6ae07a986e88cc83e641396fa0e037e339db4b773","59be93cef896620205c7ab2ac270f94ca105e424670671b3c7f23ee2a569faf5"],"identifiableWithinGridResolution":true,"improvesMidpointBaseline":true,"intervalKind":"deterministic_grid_resolution_not_statistical_confidence","midpointBaselineValue":0.154919333848,"normalizedParameterError":3.4091468e-05,"observations":[{"fixtureKind":"tensioned_gravity_sag_coupon","measuredResponse":0.00974656388,"observationHash":"8b06bd033d68fd29dd9977a09c56355d6e93bfc87b34769eeade7c04dbffddf8","observationId":"coupon.material.lightweight_knit_d0_v1.arealDensity.calibration.00","parameter":"arealDensity","realFabricMeasurement":false,"responseUnit":"m_gravity_sag","sourceKind":"project_authored_synthetic_numerical_fixture","split":"calibration","stimulus":0.72,"stimulusUnit":"normalized_fixture_control"},{"fixtureKind":"tensioned_gravity_sag_coupon","measuredResponse":0.014633042377,"observationHash":"340c618c290d18dcc0c0d9800ab8951269bd988a10fb3fae17acfcdf3ec5fb27","observationId":"coupon.material.lightweight_knit_d0_v1.arealDensity.calibration.01","parameter":"arealDensity","realFabricMeasurement":false,"responseUnit":"m_gravity_sag","sourceKind":"project_authored_synthetic_numerical_fixture","split":"calibration","stimulus":1.08,"stimulusUnit":"normalized_fixture_control"},{"fixtureKind":"tensioned_gravity_sag_coupon","measuredResponse":0.019482309221,"observationHash":"bcd2340ab901a2d551791084d31c086ed7a5b930a286e801a34693c3047303d1","observationId":"coupon.material.lightweight_knit_d0_v1.arealDensity.calibration.02","parameter":"arealDensity","realFabricMeasurement":false,"responseUnit":"m_gravity_sag","sourceKind":"project_authored_synthetic_numerical_fixture","split":"calibration","stimulus":1.44,"stimulusUnit":"normalized_fixture_control"},{"fixtureKind":"tensioned_gravity_sag_coupon","measuredResponse":0.0121843817,"observationHash":"cdfe9ee942f3331791a641f6ae07a986e88cc83e641396fa0e037e339db4b773","observationId":"coupon.material.lightweight_knit_d0_v1.arealDensity.holdout.00","parameter":"arealDensity","realFabricMeasurement":false,"responseUnit":"m_gravity_sag","sourceKind":"project_authored_synthetic_numerical_fixture","split":"holdout","stimulus":0.9,"stimulusUnit":"normalized_fixture_control"},{"fixtureKind":"tensioned_gravity_sag_coupon","measuredResponse":0.01705121138,"observationHash":"59be93cef896620205c7ab2ac270f94ca105e424670671b3c7f23ee2a569faf5","observationId":"coupon.material.lightweight_knit_d0_v1.arealDensity.holdout.01","parameter":"arealDensity","realFabricMeasurement":false,"responseUnit":"m_gravity_sag","sourceKind":"project_authored_synthetic_numerical_fixture","split":"holdout","stimulus":1.26,"stimulusUnit":"normalized_fixture_control"}],"parameter":"arealDensity","recordHash":"6e2d07ff01460df0e79d9a0731f32d967a1b751fe68bfd391aa450efd8478e54","searchBounds":[0.03,0.8],"searchScale":"log","unit":"kg/m^2"},{"authoredSyntheticTruth":320.0,"baselineHoldoutNormalizedRmse":0.01201528272,"calibrationObjective":1.916991e-06,"calibrationObservationHashes":["02b252b01de20cd1368375030623ed9fe0d5126607df753d82f6fc183c70e9de","327ba228b89736184e4732f3f37db6fd10ae76961662e9e2ff8c72706d83ccb5","acea21e69671fbf71d3e4bb69b52bba64c4917733ccf748e823f033704ade090"],"candidateCount":2049,"estimatedValue":320.519418182766,"finite":true,"fixtureKind":"warp_uniaxial_coupon","gridResolutionInterval":[319.656453359947,321.384712720119],"holdoutNormalizedRmse":0.001818757033,"holdoutObservationHashes":["b4c77dfe7d6340b9ad44c181f91f8171214265a5f00224e3a3fa11619888c5b1","2481e307e5b15b9972ea0e55aadd5284e7abee15629c4b28a282d759d8a36838"],"identifiableWithinGridResolution":true,"improvesMidpointBaseline":true,"intervalKind":"deterministic_grid_resolution_not_statistical_confidence","midpointBaselineValue":316.227766016838,"normalizedParameterError":0.00010430084,"observations":[{"fixtureKind":"warp_uniaxial_coupon","measuredResponse":0.040521419856,"observationHash":"02b252b01de20cd1368375030623ed9fe0d5126607df753d82f6fc183c70e9de","observationId":"coupon.material.lightweight_knit_d0_v1.warpStretchStiffness.calibration.00","parameter":"warpStretchStiffness","realFabricMeasurement":false,"responseUnit":"ratio_extension","sourceKind":"project_authored_synthetic_numerical_fixture","sp